{
  "action": "inspect_contract",
  "agent": "agent:contract-qa",
  "approval_ref": null,
  "arguments": {"block": 123456, "function": "owner"},
  "arguments_digest": "sha256:46b4807f018fe5bddca7515fd08ebe0202e8a0eae0b4b60035fbc5a6ba3c1472",
  "attempt_id": "attempt-001",
  "auth_context_digest": "sha256:dddddddddddddddddddddddddddddddddddddddddddddddddddddddddddddddd",
  "contains_secret": false,
  "data_classification": "public",
  "delegation_chain": [],
  "destination": null,
  "expires_at": "2026-08-27T22:00:00Z",
  "idempotency_key": "inspect-001",
  "intent_id": "intent-inspect-001",
  "issued_at": "2026-08-27T20:00:00Z",
  "metadata": {"source": "synthetic-test"},
  "method": "tool_call",
  "nonce": "nonce-001",
  "parent_cause": "user-request-001",
  "parent_request_id": null,
  "parent_span_id": "span-parent",
  "policy_version": "policy-2026-08-27",
  "profile": "org.causalcell.action-proposal.v0.1",
  "proposal_digest": "sha256:36a10a4664f2503283516c719fe3b9f6b94512bcaa9396520d4353f58e3eae4b",
  "request_id": "request-001",
  "resource_budget": {
    "max_cost": 1.0,
    "max_fan_out": 0,
    "max_retries": 0,
    "max_seconds": 10,
    "max_steps": 2
  },
  "retry_of_attempt_id": null,
  "reversibility": "reversible",
  "risk_tier": "low",
  "schema_version": 1,
  "scope": "contract.read",
  "span_id": "span-001",
  "subject": "user:alice",
  "target": "evm:8453:0x1111111111111111111111111111111111111111",
  "target_state_digest": "sha256:cccccccccccccccccccccccccccccccccccccccccccccccccccccccccccccccc",
  "tool_origin": "registry.example.test/contract-reader",
  "tool_schema_digest": "sha256:aaaaaaaaaaaaaaaaaaaaaaaaaaaaaaaaaaaaaaaaaaaaaaaaaaaaaaaaaaaaaaaa",
  "tool_version": "1.0.0",
  "trace_id": "trace-001",
  "untrusted_context": [],
  "workload": "workload:local-reference"
}
